"DO NOT EDIT","Thai"
"To administer a contest, promotion, survey or other site feature","ในการจัดการประกวดการส่งเสริมการสำรวจหรือคุณลักษณะเว็บไซต์อื่นๆ"
"To send periodic emails. The email address you provide for order processing, may be used to send you information and updates pertaining to your order, in addition to receiving occasional company news, updates, related product or service information, etc. Note: If at any time you would like to unsubscribe from receiving future emails, we include detailed unsubscribe instructions at the bottom of each email.","เพื่อส่งอีเมล์ ที่อยู่อีเมล์ของคุณให้สำหรับการประมวลผลเพื่อจะนำไปใช้ในการส่งข้อมูลและการปรับปรุงเกี่ยวกับการสั่งซื้อของคุณนอกเหนือจากการได้รับข่าวบริษัทปรับปรุงผลิตภัณฑ์หรือบริการที่เกี่ยวข้องกับข้อมูลเป็นครั้งคราวอื่นๆ หมายเหตุ: ถ้าเมื่อใดก็ตามที่คุณต้องการ ยกเลิกการสมัครรับอีเมลในอนาคตเรามีคำแนะนำยกเลิกการเป็นสมาชิกรายละเอียดที่ด้านล่างของอีเมลแต่ละ."
"Your information, whether public or private, will not be sold, exchanged, transferred, or given to any other company for any reason whatsoever, without your consent, other than for the express purpose of delivering the purchased product or service requested.","ข้อมูลของคุณไม่ว่าจะเป็นภาครัฐหรือเอกชนจะไม่ถูกขายแลกเปลี่ยนโอนหรือมอบให้กับบริษัทอื่นๆด้วยเหตุผลใดๆ ก็ตามโดยปราศจากความยินยอมของคุณนอกเหนือจากความประสงค์ที่จะส่งมอบผลิตภัณฑ์ที่จัดซื้อหรือการบริการที่ร้องขอ"
"How do we protect your information?","เราจะปกป้องข้อมูลของคุณอย่างไร?"
"We implement a variety of security measures to maintain the safety of your personal information when you place an order or enter, submit, or access your personal information.","เราใช้ความหลากหลายของมาตรการรักษาความปลอดภัยในการรักษาความปลอดภัยของข้อมูลส่วนบุคคลของคุณเมื่อคุณสั่งซื้อสินค้า ป้อนส่งหรือเข้าถึงข้อมูลส่วนบุคคลของคุณ"
"We offer the use of a secure server. All supplied sensitive/credit information is transmitted via Secure Socket Layer (SSL) technology and then encrypted into our Payment gateway providers database only to be accessible by those authorized with special access rights to such systems, and are required to keep the information confidential.","เรานำเสนอการใช้งานของเซิร์ฟเวอร์ที่เชื่อถือได้ของเรา จัดมาให้ข้อมูลที่สำคัญ / เครดิตทั้งหมดจะถูกส่งผ่านเทคโนโลยี Secure Socket Layer (SSL) และการเข้ารหัสแล้วเข้าไปในการชำระเงินฐานข้อมูลผู้ให้บริการเกตเวย์ของเราเท่านั้นที่จะสามารถเข้าถึงได้โดยผู้ที่ได้รับอนุญาตมีสิทธิเข้าถึงพิเศษกับระบบดังกล่าวและจะต้องเก็บข้อมูลที่เป็นความลับ"
"After a transaction, your private information (credit cards, social security numbers, financials, etc.) will not be kept on file for more than 60 days.","หลังจากการทำธุรกรรมข้อมูลส่วนตัวของคุณ (บัตรเครดิตหมายเลขประกันสังคม, การเงิน, ฯลฯ) จะไม่ถูกเก็บไว้ในไฟล์นานกว่า 60 วัน"
"Do we use cookies?","เราใช้คุกกี้?"
"Yes (Cookies are small files that a site or its service provider transfers to your computers hard drive through your Web browser (if you allow) that enables the sites or service providers systems to recognize your browser and capture and remember certain information","ใช่ (คุกกี้เป็นไฟล์ขนาดเล็กที่เว็บไซต์หรือการโอนเงินผ่านผู้ให้บริการกับคอมพิวเตอร์ของคุณฮาร์ดไดรฟ์ผ่านเว็บเบราว์เซอร์ของคุณ (หากคุณอนุญาต) ที่ช่วยให้เว็บไซต์หรือระบบผู้ให้บริการในการรับรู้และการจับภาพเบราว์เซอร์ของคุณและจำข้อมูลบางอย่าง"
"We use cookies to help us remember and process the items in your shopping cart, understand and save your preferences for future visits and compile aggregate data about site traffic and site interaction so that we can offer better site experiences and tools in the future. We may contract with third-party service providers to assist us in better understanding our site visitors. These service providers are not permitted to use the information collected on our behalf except to help us conduct and improve our business.","เราใช้คุกกี้เพื่อช่วยให้เราจำและประมวลผลรายการสินค้าในตะกร้าช้อปปิ้งของคุณเข้าใจและบันทึกการตั้งค่าของคุณสำหรับการเข้าชมในอนาคตและรวบรวมข้อมูลโดยรวมเกี่ยวกับการเข้าชมเว็บไซต์และการมีปฏิสัมพันธ์เว็บไซต์เพื่อให้เราสามารถนำเสนอประสบการณ์ที่ดีกว่าเว็บไซต์และเครื่องมือในอนาคต เราอาจทำสัญญากับผู้ให้บริการของบุคคลที่สามที่จะช่วยให้เราทำความเข้าใจกับผู้เข้าชมเว็บไซต์ของเรา ผู้ให้บริการเหล่านี้ไม่ได้รับอนุญาตให้ใช้ข้อมูลที่เก็บรวบรวมในนามของเรานอกจากจะช่วยให้เราดำเนินการและปรับปรุงธุรกิจของเรา"
"If you prefer, you can choose to have your computer warn you each time a cookie is being sent, or you can choose to turn off all cookies via your browser settings. Like most websites, if you turn your cookies off, some of our services may not function properly. However, you can still place orders over the telephone or by contacting customer service.","หากคุณต้องการคุณสามารถเลือกที่จะมีเครื่องคอมพิวเตอร์ของคุณเตือนคุณทุกครั้งที่คุกกี้ถูกส่งหรือคุณสามารถเลือกที่จะปิดคุกกี้ทั้งหมดผ่านการตั้งค่าเบราว์เซอร์ของคุณ เช่นเดียวกับเว็บไซต์มากที่สุดหากคุณเปิดคุกกี้ของคุณปิดบางส่วนของการบริการของเราอาจไม่ทำงานอย่างถูกต้อง แต่คุณยังสามารถสั่งซื้อสินค้าผ่านทางโทรศัพท์หรือโดยการบริการลูกค้าที่ติดต่อ"
"Do we disclose any information to outside parties?","เราจะเปิดเผยข้อมูลใดๆ ให้แก่บุคคลภายนอกหรือไม่?"
"We do not sell, trade, or otherwise transfer to outside parties your personally identifiable information. This does not include trusted third parties who assist us in operating our website, conducting our business, or servicing you, so long as those parties agree to keep this information confidential. We may also release your information when we believe release is appropriate to comply with the law, enforce our site policies, or protect ours or others rights, property, or safety. However, non-personally identifiable visitor information may be provided to other parties for marketing, advertising, or other uses.","เราไม่ขาย แลกเปลี่ยนหรือโอนให้แก่บุคคลภายนอกกับข้อมูลส่วนบุคคลของคุณ นี้ไม่รวมถึงบุคคลที่สามที่เชื่อถือได้ที่ช่วยเราในการดำเนินงานเว็บไซต์ของเราดำเนินธุรกิจของเราหรือบริการคุณดังนั้นตราบใดที่บุคคลเหล่านั้นเห็นด้วยกับการเก็บข้อมูลนี้เป็นความลับ นอกจากนี้เรายังอาจปล่อยข้อมูลของคุณเมื่อเราเชื่อว่าการเปิดตัวมีความเหมาะสมเพื่อให้สอดคล้องกับกฎหมายที่บังคับใช้นโยบายเว็บไซต์ของเราหรือปกป้องเราหรือคนอื่นๆ สิทธิทรัพย์สินหรือความปลอดภัย อย่างไรก็ตามข้อมูลของผู้เข้าชมที่ไม่ระบุตัวบุคคลอาจจะให้แก่บุคคลอื่นสำหรับการตลาด การโฆษณา หรือใช้งานอื่นๆ"
"Third party links","การเชื่อมโยงของบุคคลที่สาม"
"Occasionally, at our discretion, we may include or offer third party products or services on our website. These third party sites have separate and independent privacy policies. We therefore have no responsibility or liability for the content and activities of these linked sites. Nonetheless, we seek to protect the integrity of our site and welcome any feedback about these sites.","บางครั้งขึ้นอยู่กับดุลยพินิจของเรา เราอาจรวมหรือนำเสนอผลิตภัณฑ์ของบุคคลที่สามหรือบริการบนเว็บไซต์ของเรา เว็บไซต์เหล่านี้บุคคลที่สามที่มีนโยบายความเป็นส่วนตัวและเป็นอิสระแยกจากกัน ดังนั้นเราจึงมีความรับผิดชอบหรือไม่รับผิดสำหรับเนื้อหาและกิจกรรมของเว็บไซต์ที่เชื่อมโยงเหล่านี้ อย่างไรก็ตามเราพยายามที่จะปกป้องความสมบูรณ์ของเว็บไซต์ของเราและยินดีต้อนรับความคิดเห็นใดๆ เกี่ยวกับเว็บไซต์เหล่านี้"
"Singapore Data Protection Act","พระราชบัญญัติคุ้มครองข้อมูลสิงคโปร์"
"We are in compliance with the requirements of the Singapore Personal Data Collection Act. We adhere to the 9 data protection obligations of the Personal Data Collection Act namely; Consent Obligation; Purpose Limitation Obligation; Notification Obligation; Access & Correction Obligation; Accuracy Obligation; Protection Obligation; Retention Limitation Obligation; Transfer Limitation Obligation and Openness Obligation.","เราอยู่ในการปฏิบัติตามข้อกำหนดของพระราชบัญญัติสิงคโปร์ส่วนบุคคลการเก็บรวบรวมข้อมูล เรายึดมั่นในภาระหน้าที่ป้องกันข้อมูล 9 แห่งพระราชบัญญัติข้อมูลส่วนบุคคลการเก็บคือ; ได้รับความยินยอมรับผิดชอบ; วัตถุประสงค์ข้อจำกัดความรับผิดชอบ; รับผิดชอบการแจ้งเตือน การเข้าถึงและการแก้ไขความรับผิดชอบ; ความรับผิดชอบความถูกต้อง คุ้มครองความรับผิดชอบ; การเก็บรักษาข้อจำกัดความรับผิดชอบ; ข้อจำกัด ในการถ่ายโอนความรับผิดชอบและการเปิดกว้างความรับผิดชอบ"
"Online Privacy Policy Only","นโยบายความเป็นส่วนตัวออนไลน์เท่านั้น"
"This online privacy policy applies only to information collected through our website and not to information collected offline","นโยบายความเป็นส่วนตัวออนไลน์นี้ใช้เฉพาะกับข้อมูลที่เก็บรวบรวมผ่านเว็บไซต์ของเราและไม่ให้ข้อมูลที่เก็บรวบรวมแบบออฟไลน์"
"Your Consent","ความยินยอมของคุณ"
"By using our site, you consent to our websites privacy policy.","โดยใช้เว็บไซต์ของเราคุณยินยอมที่จะนโยบายเว็บไซต์ส่วนตัวของเรา"
"Contacting Us","การติดต่อกับเรา"
"If there are any questions regarding this policy you may contact us using the information below.","หากมีข้อสงสัยใดๆ เกี่ยวกับนโยบายนี้คุณสามารถติดต่อเราโดยใช้ข้อมูลด้านล่างนี้"
"FUTUREED CANDIDATE TERMS AND CONDITIONS","ข้อกำหนดและเงื่อนไข FUTUREED"
"Thank you for choosing Futureed Pte Ltd. We intend to provide provide you with a best-in-industry products that are of high quality, price competitive, psychometrically sound and in a technically reliable manner. To achieve that goal, we need to make certain legal declarations to ensure that our Service is being used in a reasonable, safe, and legal way. These Terms may be updated from time to time. Notice of modifications to these Terms will appear on this page.","ขอขอบคุณที่เลือก Futures Pte Ltd สำหรับความต้องการของคุณประเมิน เราตั้งใจที่จะให้ให้คุณมีผลิตภัณฑ์ที่ดีที่สุดในอุตสาหกรรมที่มีคุณภาพสูง แข่งขันทางราคาได้ ความน่าเชื่อถือ เพื่อให้บรรลุเป้าหมายที่เราต้องการที่จะทำข้อตกลงทางกฎหมายบางอย่างเพื่อให้มั่นใจว่าบริการของเราจะถูกนำมาใช้ในทางที่เหมาะสม ปลอดภัยและถูกต้องตามกฎหมาย ข้อตกลงเหล่านี้อาจได้รับการปรับปรุงเป็นครั้งคราว เมื่อมีการปรับเปลี่ยนข้อตกลงเหล่านี้ จะมีการแจ้งให้ทราบ"
"Introduction","บทแนะนำ"
"Futureed Pte Ltd is made available by Kosh Consulting Group (Asia) Pte Ltd (KCGA) and provides an online assessment platform for assessment tools to remotely test candidates on areas of psychometric abilities and personality. The two entities are used interchangeably for legal purposes. By registering to use Futureed Pte Ltd, you are consenting to the terms and conditions as follows in this agreement. We also have a privacy policy which you can also find on our website.","Futureed Pte Ltd เปิดใช้งานได้โดย Kosh Consulting Group (Asia) Pte Ltd (KCGA) ให้เครื่องมือการประเมินออนไลน์จากระยะไกลผู้สมัครทดสอบในพื้นที่ที่มีความสามารถทางจิตวิทยาและบุคลิกภาพ ทั้งสองหน่วยงานจะใช้สลับกันเพื่อวัตถุประสงค์ทางกฎหมาย โดยการลงทะเบียนใช้ Futureed คุณจะให้ความยินยอมในข้อกำหนดและเงื่อนไขดังต่อไปนี้ในข้อตกลงนี้ เรายังมีนโยบายความเป็นส่วนตัวที่คุณสามารถค้นหาบนเว็บไซต์ของเรา"
"Responsibility for Use","ความรับผิดชอบสำหรับการใช้งาน"
"As the account user or user of Futureed Pte Ltd, you assume full responsibility for all use of Futureed Pte Ltd. You represent, warrant, and covenant that:","ในฐานะที่เป็นบัญชีผู้ใช้หรือผู้ใช้ Futures Pte Ltd คุณรับผิดชอบอย่างเต็มที่สำหรับการใช้งานทั้งหมดของ Futureed Pte Ltd คุณเป็นตัวแทนใบสำคัญแสดงสิทธิและพันธสัญญาที่"
"You will ensure that reasonable safeguards are taken for the protection of your password. You understand that we do not have access to your password and that you must create a new unique password in the event that you lose or forget your password.","คุณจะมั่นใจว่าป้องกันที่เหมาะสมจะถูกนำสำหรับการป้องกันรหัสผ่านของคุณ คุณเข้าใจดีว่าเราไม่ได้มีการเข้าถึงรหัสผ่านของคุณและคุณจะต้องสร้างรหัสผ่านที่ไม่ซ้ำกันใหม่ในกรณีที่คุณสูญเสียหรือลืมรหัสผ่านของคุณ"
"We will have the right to delete your Futureed Pte Ltd account and all associated records after a period of 18 months of inactivity on your Futureed Pte Ltd account.","เราจะมีสิทธิ์ในการลบบัญชี  Futureed Pte Ltd  ของคุณและบันทึกที่เกี่ยวข้องทั้งหมดหลังจากช่วงระยะเวลา 18 เดือนไม่มีการใช้งานในบัญชีของคุณใน Futureed Pte Ltd"
"As a responsible user, you agree that you will not use the Futureed Pte Ltd site, or any product, or service provided by or made available on or from the Futureed Pte Ltd site for any unlawful purpose.","ในฐานะที่เป็นผู้ใช้ความรับผิดชอบ คุณยอมรับว่าคุณจะไม่ใช้เว็บไซต์ Futures Pte Ltd หรือผลิตภัณฑ์ใดๆ หรือการให้บริการที่มีอยู่หรือจากเว็บไซต์ใน Futureed Pte Ltd เพื่อวัตถุประสงค์ใดๆ ที่ผิดกฎหมาย"
"Specifically, you agree to not use the Service to:","โดยเฉพาะคุณยินยอมที่จะไม่ใช้บริการเพื่อ"
"Use any device, software, or routine to interfere or attempt to interfere with the proper working of the Futureed Pte Ltd site or any activity being conducted on the Futureed Pte Ltd site.","ใช้อุปกรณ์ซอฟต์แวร์ใดๆ ที่จะแทรกแซงหรือพยายามแทรกแซงการทำงานที่เหมาะสมของเว็บไซต์ Futureed Pte Ltd หรือกิจกรรมใดๆ ที่จะถูกดำเนินการในเว็บไซต์ Futureed Pte Ltd"
"Upload, post, email, transmit or otherwise make available any Content that is unlawful, harmful, threatening, abusive, harassing, tortious, defamatory, vulgar, obscene, pornographic, libelous, invasive of another\s","อัพโหลด โพสต์ อีเมล์ ส่งหรือทำให้มีเนื้อหาใดๆ ที่ผิดกฎหมายที่เป็นอันตรายคุกคามที่ไม่เหมาะสม ล่วงละเมิด ผิดทางแพ่ง หมิ่นประมาท หยาบคาย ลามกอนาจาร หมิ่นประมาท รุกรานผู้อื่น "
"Harm minors in any way;","อันตรายต่อผู้เยาว์ในทางใดทางหนึ่ง"
"Impersonate any person or entity, including, but not limited to, a KCGA official, or host, or falsely state or otherwise misrepresent your affiliation with a person or entity;","ปลอมตัวเป็นบุคคลหรือนิติบุคคลใดๆ ซึ่งรวมถึง แต่ไม่จำกัดเพียงการอย่างเป็นทางการ KCGA หรือเจ้าภาพหรือให้ข้อมูลเท็จหรือบิดเบือนความเกี่ยวข้องกับบุคคลหรือนิติบุคคล "
"Forge headers or otherwise manipulate identifiers in order to disguise the origin of any Content transmitted through Futureed;","ปลอมส่วนหัวหรือมิฉะนั้นจะจัดการกับตัวบ่งชี้ในการสั่งซื้อที่จะปกปิดที่มาของเนื้อหาใดๆ ที่ส่งผ่าน Futureed นั้น"
